### ISSUE TITLE
Question: Layer 4 TCP: is there a way to get length of header and data in bytes?

### ISSUE THREAD

**Issue by mdesco18** [mike01/pypacker#43]
As the title suggests,

I'm trying to use the TCP class in layer 4 to extract TCP header information but I don't know what method to use to get the number of bytes. 

Wireshark will give the following information from a single packet:

No.     Time        Source                Destination           Protocol **Length** Info
      1 0.000000    192.168.1.164         142.104.5.64          TCP      **62**     1200→80 [SYN] Seq=0 Win=16384 Len=0 MSS=1460 SACK_PERM=1

Frame 1: 62 bytes on wire (496 bits), **62 bytes captured** (496 bits)
Ethernet II, Src: Intel_a1:48:60 (00:0e:35:a1:48:60), Dst: 3com_20:98:c5 (00:10:5a:20:98:c5)
Internet Protocol Version 4, Src: 192.168.1.164 (192.168.1.164), Dst: 142.104.5.64 (142.104.5.64)
Transmission Control Protocol, Src Port: 1200 (1200), Dst Port: 80 (80), Seq: 0, Len: 0

What I'm looking for is the Length given from the TCP header or the bytes captured from the frame.

This is a great module and thanks in advance.
